{
  "component": "aya-component/v1",
  "id": "sample.help.home",
  "operation": "help",
  "guideAsset": "aya-guide.md",
  "screenName": "Home",
  "presentation": {
    "kind": "card",
    "title": "Ask Your Agent",
    "description": "Ask about using this sample app or the AYA handoff. You can review the complete reference before sharing.",
    "attachmentDisclosure": "A reference for this sample app is offered as a text file. Your selected AI app may not accept attachments.",
    "outputInstructions": "Read your agent's answer and follow its advice yourself. This sample does not import or apply help responses automatically.",
    "density": "standard"
  }
}
